{
  "$schema": "../../schemas/family.schema.json",
  "aliases": [],
  "attribution_confidence": "unknown",
  "classification": "provisional_cluster",
  "description": "Provisional grouping based only on recurring exported-log structure. Historical tracking labels are analyst shorthand, not confirmed malware-family attribution.",
  "external_references": [],
  "id": "unattributed-58d1d7e3d4348cb9a01ee1ec2cde70b8",
  "name": "Unattributed cluster 58d1d7e3d4348cb9a01ee1ec2cde70b8",
  "schema_version": "1.0",
  "targets": [],
  "tracking_labels": [
    "CSBestPrivateLoggerStealer"
  ]
}
