{
  "$schema": "../../schemas/family.schema.json",
  "aliases": [],
  "attribution_confidence": "unknown",
  "classification": "provisional_cluster",
  "description": "Provisional grouping based only on recurring exported-log structure. Historical tracking labels are analyst shorthand, not confirmed malware-family attribution.",
  "external_references": [],
  "id": "unattributed-e1f953de8ad63d7d4bea246d9eafedcf",
  "name": "Unattributed cluster e1f953de8ad63d7d4bea246d9eafedcf",
  "schema_version": "1.0",
  "targets": [],
  "tracking_labels": [
    "CSBestPrivateLoggerStealer"
  ]
}
