{
  "$schema": "../../schemas/family.schema.json",
  "aliases": [],
  "attribution_confidence": "unknown",
  "classification": "provisional_cluster",
  "description": "Provisional grouping based only on recurring exported-log structure. Historical tracking labels are analyst shorthand, not confirmed malware-family attribution.",
  "external_references": [],
  "id": "unattributed-eed7f6d6f951d7ce81b6c69003e3dcad",
  "name": "Unattributed cluster eed7f6d6f951d7ce81b6c69003e3dcad",
  "schema_version": "1.0",
  "targets": [],
  "tracking_labels": [
    "CSSoftwareTailStealer"
  ]
}
