{
  "$schema": "../../schemas/family.schema.json",
  "aliases": [],
  "attribution_confidence": "unknown",
  "classification": "provisional_cluster",
  "description": "Provisional grouping based only on recurring exported-log structure. Historical tracking labels are analyst shorthand, not confirmed malware-family attribution.",
  "external_references": [],
  "id": "unattributed-ad4802c6f25bb31f6ae11eaaea3dcad8",
  "name": "Unattributed cluster ad4802c6f25bb31f6ae11eaaea3dcad8",
  "schema_version": "1.0",
  "targets": [],
  "tracking_labels": [
    "RedlineLike Stealer"
  ]
}
