{
  "$schema": "../../schemas/family.schema.json",
  "aliases": [],
  "attribution_confidence": "low",
  "classification": "provisional_cluster",
  "description": "Provisional grouping based only on recurring exported-log structure. Historical tracking labels are analyst shorthand, not confirmed malware-family attribution.",
  "external_references": [],
  "id": "unattributed-cf4d4b2b1fb07476894f382450f840a8",
  "name": "Unattributed cluster cf4d4b2b1fb07476894f382450f840a8",
  "schema_version": "1.0",
  "targets": [],
  "tracking_labels": [
    "CSSigInfoStealer"
  ]
}
