{
  "$schema": "../../schemas/family.schema.json",
  "aliases": [],
  "attribution_confidence": "unknown",
  "classification": "provisional_cluster",
  "description": "Provisional grouping based only on recurring exported-log structure. Historical tracking labels are analyst shorthand, not confirmed malware-family attribution.",
  "external_references": [],
  "id": "unattributed-c9ec19ab31fd324e7f54f3b8f42f8180",
  "name": "Unattributed cluster c9ec19ab31fd324e7f54f3b8f42f8180",
  "schema_version": "1.0",
  "targets": [],
  "tracking_labels": [
    "CSEmojiCountStealer"
  ]
}
