{
  "$schema": "../../schemas/family.schema.json",
  "aliases": [],
  "attribution_confidence": "low",
  "classification": "provisional_cluster",
  "description": "Provisional grouping based only on recurring exported-log structure. Historical tracking labels are analyst shorthand, not confirmed malware-family attribution.",
  "external_references": [],
  "id": "unattributed-6d44c2a9742cfbef977562be6ed977bf",
  "name": "Unattributed cluster 6d44c2a9742cfbef977562be6ed977bf",
  "schema_version": "1.0",
  "targets": [],
  "tracking_labels": [
    "CSDashSectionStealer"
  ]
}
