{
  "$schema": "../../schemas/family.schema.json",
  "aliases": [],
  "attribution_confidence": "unknown",
  "classification": "provisional_cluster",
  "description": "Provisional grouping based only on recurring exported-log structure. Historical tracking labels are analyst shorthand, not confirmed malware-family attribution.",
  "external_references": [],
  "id": "unattributed-57b440dfb8287104b2b740725cab9342",
  "name": "Unattributed cluster 57b440dfb8287104b2b740725cab9342",
  "schema_version": "1.0",
  "targets": [],
  "tracking_labels": [
    "RedlineLike Stealer"
  ]
}
