{
  "$schema": "../../schemas/family.schema.json",
  "aliases": [],
  "attribution_confidence": "unknown",
  "classification": "provisional_cluster",
  "description": "Provisional grouping based only on recurring exported-log structure. Historical tracking labels are analyst shorthand, not confirmed malware-family attribution.",
  "external_references": [],
  "id": "unattributed-4aaeab405c70b1a4977aa5689291d9b6",
  "name": "Unattributed cluster 4aaeab405c70b1a4977aa5689291d9b6",
  "schema_version": "1.0",
  "targets": [],
  "tracking_labels": [
    "CSBitArchStealer"
  ]
}
