{
  "$schema": "../../schemas/family.schema.json",
  "aliases": [],
  "attribution_confidence": "unknown",
  "classification": "provisional_cluster",
  "description": "Provisional grouping based only on recurring exported-log structure. Historical tracking labels are analyst shorthand, not confirmed malware-family attribution.",
  "external_references": [],
  "id": "unattributed-577eebb64f24c68225a8d190379990b5",
  "name": "Unattributed cluster 577eebb64f24c68225a8d190379990b5",
  "schema_version": "1.0",
  "targets": [],
  "tracking_labels": [
    "CSGADSPanelStealer"
  ]
}
