{
  "$schema": "../../schemas/family.schema.json",
  "aliases": [],
  "attribution_confidence": "unknown",
  "classification": "provisional_cluster",
  "description": "Provisional grouping based only on recurring exported-log structure. Historical tracking labels are analyst shorthand, not confirmed malware-family attribution.",
  "external_references": [],
  "id": "unattributed-c30f704fd4f93148ad422152d7f71926",
  "name": "Unattributed cluster c30f704fd4f93148ad422152d7f71926",
  "schema_version": "1.0",
  "targets": [],
  "tracking_labels": [
    "CSGeoSysInfoStealer"
  ]
}
