{
  "$schema": "../../schemas/family.schema.json",
  "aliases": [],
  "attribution_confidence": "unknown",
  "classification": "provisional_cluster",
  "description": "Provisional grouping based only on recurring exported-log structure. Historical tracking labels are analyst shorthand, not confirmed malware-family attribution.",
  "external_references": [],
  "id": "unattributed-9f895bd93d3d0b1731b8c5914a2a3896",
  "name": "Unattributed cluster 9f895bd93d3d0b1731b8c5914a2a3896",
  "schema_version": "1.0",
  "targets": [],
  "tracking_labels": [
    "CSBuildBlockStealer"
  ]
}
