{
  "$schema": "../../schemas/family.schema.json",
  "aliases": [],
  "attribution_confidence": "unknown",
  "classification": "provisional_cluster",
  "description": "Provisional grouping based only on recurring exported-log structure. Historical tracking labels are analyst shorthand, not confirmed malware-family attribution.",
  "external_references": [],
  "id": "unattributed-3ba710bb2b8fbd92ebf39c89fc4cb583",
  "name": "Unattributed cluster 3ba710bb2b8fbd92ebf39c89fc4cb583",
  "schema_version": "1.0",
  "targets": [],
  "tracking_labels": [
    "CSMacUserinfoStealer"
  ]
}
