{
  "$schema": "../../schemas/family.schema.json",
  "aliases": [],
  "attribution_confidence": "unknown",
  "classification": "provisional_cluster",
  "description": "Provisional grouping based only on recurring exported-log structure. Historical tracking labels are analyst shorthand, not confirmed malware-family attribution.",
  "external_references": [],
  "id": "unattributed-fa4ca3cb0734466fb4ecace65e389e26",
  "name": "Unattributed cluster fa4ca3cb0734466fb4ecace65e389e26",
  "schema_version": "1.0",
  "targets": [],
  "tracking_labels": [
    "CSOneGoStealer"
  ]
}
