{
  "$schema": "../../schemas/family.schema.json",
  "aliases": [],
  "attribution_confidence": "low",
  "classification": "provisional_cluster",
  "description": "Provisional grouping based only on recurring exported-log structure. Historical tracking labels are analyst shorthand, not confirmed malware-family attribution.",
  "external_references": [],
  "id": "unattributed-444b05c99a19350d143681c4acb53846",
  "name": "Unattributed cluster 444b05c99a19350d143681c4acb53846",
  "schema_version": "1.0",
  "targets": [],
  "tracking_labels": [
    "CSOttomanPanelStealer"
  ]
}
