{
  "$schema": "../../schemas/family.schema.json",
  "aliases": [],
  "attribution_confidence": "unknown",
  "classification": "provisional_cluster",
  "description": "Provisional grouping based only on recurring exported-log structure. Historical tracking labels are analyst shorthand, not confirmed malware-family attribution.",
  "external_references": [],
  "id": "unattributed-42afdacc7cf09270fbae373201bb629e",
  "name": "Unattributed cluster 42afdacc7cf09270fbae373201bb629e",
  "schema_version": "1.0",
  "targets": [],
  "tracking_labels": [
    "CSGeoSysInfoStealer"
  ]
}
