{
  "$schema": "../../schemas/family.schema.json",
  "aliases": [],
  "attribution_confidence": "unknown",
  "classification": "provisional_cluster",
  "description": "Provisional grouping based only on recurring exported-log structure. Historical tracking labels are analyst shorthand, not confirmed malware-family attribution.",
  "external_references": [],
  "id": "unattributed-d763e48ac5c9218c98f81268e7ad6110",
  "name": "Unattributed cluster d763e48ac5c9218c98f81268e7ad6110",
  "schema_version": "1.0",
  "targets": [],
  "tracking_labels": [
    "CSMSKDateStealer"
  ]
}
