{
  "$schema": "../../schemas/family.schema.json",
  "aliases": [],
  "attribution_confidence": "unknown",
  "classification": "provisional_cluster",
  "description": "Provisional grouping based only on recurring exported-log structure. Historical tracking labels are analyst shorthand, not confirmed malware-family attribution.",
  "external_references": [],
  "id": "unattributed-38d2b4a6054e4cc3abcd77fd75028766",
  "name": "Unattributed cluster 38d2b4a6054e4cc3abcd77fd75028766",
  "schema_version": "1.0",
  "targets": [],
  "tracking_labels": [
    "CSBareVersionStealer"
  ]
}
