{
  "$schema": "../../schemas/family.schema.json",
  "aliases": [],
  "attribution_confidence": "unknown",
  "classification": "provisional_cluster",
  "description": "Provisional grouping based only on recurring exported-log structure. Historical tracking labels are analyst shorthand, not confirmed malware-family attribution.",
  "external_references": [],
  "id": "unattributed-af81db59c44117b802e24158702f7dcf",
  "name": "Unattributed cluster af81db59c44117b802e24158702f7dcf",
  "schema_version": "1.0",
  "targets": [],
  "tracking_labels": [
    "CSMacBareGeoStealer"
  ]
}
